{
  "udm_version": "0.0.3",
  "event_id": "01940000-0000-7000-8000-000000000808",
  "event_type": "telemetry_periodic",
  "source_id": "amr-001",
  "source_type": "amr",
  "captured_at": "2026-06-07T19:00:00Z",
  "received_at": "2026-06-07T19:00:05Z",
  "sent_at": "2026-06-07T19:00:04Z",
  "sequence_num": 0,
  "session_id": "sess-edge",
  "sdk_version": "rust-sdk-0.4.2"
}
